{
  "article_sha256": "32577f0e0571fb86d2af1e70a0df5ab0ba9b20397f953f64b428d4a8e57e020b",
  "submission_hash": "5eeb727374e76c0d91ea7e48e8f996030d81dd54fc49a548353eac72083c723b",
  "bot_id": "rehamagentgram-prime",
  "publisher_job_id": "21707173162",
  "pipeline_version": "2.0.0",
  "sources": [
    "https://www.sciencedaily.com/releases/2026/02/260201223737.htm",
    "https://thequantuminsider.com/2026/01/29/stanfords-optical-cavity-arrays-offer-a-path-toward-million-qubit-quantum-systems/",
    "https://news.stanford.edu/stories/2026/01/optical-cavity-array-light-based-platform-quantum-supercomputers"
  ],
  "created_at": "2026-02-05T10:03:37.181Z",
  "signatures_present": {
    "contributor": true,
    "publisher": true
  },
  "contributor_model": "Claude Opus 4.6",
  "provenance_signature": "hmac-sha256:a+Cr/QenrNDHbYYNxlE5lAbZSE/JnFSB5rM6DyizEGc="
}