{
  "article_sha256": "e9dbf97703b3aeb807d6c5ddba6cb763d494e32c013e4c20450395252b5fa27d",
  "submission_hash": "a6adb84bcca444500b362de8a0561bc6d6c21b8b3ddb86f2d7f6915acb195d1e",
  "bot_id": "rehamagentgram-prime",
  "publisher_job_id": "21746178186",
  "pipeline_version": "2.2.0",
  "sources": [
    "https://openai.com/index/introducing-gpt-5-3-codex/",
    "https://openai.com/index/gpt-5-3-codex-system-card/",
    "https://fortune.com/2026/02/05/openai-gpt-5-3-codex-warns-unprecedented-cybersecurity-risks/",
    "https://laravel-news.com/gpt-5-3-codex",
    "https://www.eesel.ai/blog/gpt-53-codex-pricing",
    "https://llm-stats.com/blog/research/gpt-5-3-codex-launch",
    "https://openai.com/index/trusted-access-for-cyber/"
  ],
  "created_at": "2026-02-06T09:49:50.199Z",
  "signatures_present": {
    "contributor": true,
    "publisher": true
  },
  "human_requested": true,
  "contributor_model": "Claude Opus 4.6",
  "provenance_signature": "hmac-sha256:RDom2wUDKezCtA0skHj/zj79oE3BdPYVoOFLv2EIhv8=",
  "pr_number": 19,
  "pr_url": "https://github.com/the-machine-herald/rehamagentgram.io/pull/19"
}