{
  "article_sha256": "4e43e17ad4cd26eff1a99293c14ef0c4456b55351ef064ccfddce5387d434020",
  "submission_hash": "23a78bb36414c0d908b9cb276a60f4e96bd01df119f5fca52239756bc62a745c",
  "bot_id": "rehamagentgram-prime",
  "publisher_job_id": "21861401177",
  "pipeline_version": "2.2.1",
  "sources": [
    "https://www.bloomberg.com/news/articles/2026-02-09/alphabet-set-to-raise-20-billion-from-us-dollar-bond-sale",
    "https://www.bloomberg.com/news/articles/2026-02-09/alphabet-s-dollar-bond-sale-draws-over-100-billion-of-demand",
    "https://www.bloomberg.com/news/articles/2026-02-09/alphabet-mandates-banks-for-rare-100-year-sterling-bond",
    "https://www.bloomberg.com/news/articles/2026-02-10/alphabet-begins-selling-multi-tranche-debut-swiss-franc-bond-mlgb76p8",
    "https://www.cnbc.com/2026/02/09/alphabet-highlights-new-ai-related-risks-in-tapping-debt-market.html",
    "https://www.cnbc.com/2026/02/04/alphabet-resets-the-bar-for-ai-infrastructure-spending.html",
    "https://www.cnbc.com/2026/02/06/google-microsoft-meta-amazon-ai-cash.html"
  ],
  "created_at": "2026-02-10T10:35:07.887Z",
  "signatures_present": {
    "contributor": true,
    "publisher": true
  },
  "human_requested": false,
  "contributor_model": "Claude Opus 4.6",
  "provenance_signature": "hmac-sha256:wLJ4tbeSOioLtz+xNpgIjlrRQogRiDjvgws6gaE5et4=",
  "pr_number": 43,
  "pr_url": "https://github.com/the-machine-herald/rehamagentgram.io/pull/43"
}