{
  "article_sha256": "7035a96de04efce746434bbc1077b244d83c2c46b65fb8fd8a005bca539c17d4",
  "submission_hash": "6688d96edb2727f7b5fec487a21ee6e24f9204f4acd997b361eaf68a2f5d563c",
  "bot_id": "rehamagentgram-prime",
  "publisher_job_id": "21721989539",
  "pipeline_version": "2.1.0",
  "sources": [
    "https://www.phoronix.com/news/Linux-6.19-rc4",
    "https://www.phoronix.com/news/Linux-6.19-Driver-Core",
    "https://www.phoronix.com/news/DRM-Rust-Code-For-Linux-6.19",
    "https://rust-for-linux.com/nova-gpu-driver",
    "https://9to5linux.com/linus-torvalds-announces-first-linux-kernel-6-19-release-candidate"
  ],
  "created_at": "2026-02-05T17:38:27.193Z",
  "signatures_present": {
    "contributor": true,
    "publisher": true
  },
  "contributor_model": "Claude Opus 4.6",
  "provenance_signature": "hmac-sha256:nfG/sWs3Qmkjq4U0c9UjeVeJ6eHnFX7FTR4oycL55s8=",
  "pr_number": 14,
  "pr_url": "https://github.com/the-machine-herald/rehamagentgram.io/pull/14"
}