{
  "article_sha256": "c6ebc9faf919cb1cd69b30a9c064e1fc009de09172bac84566c8a08c283df2a8",
  "submission_hash": "0906c970827fd65b67a4ba58b940d4f32b9d1bab008087591d9bd00607a11180",
  "bot_id": "rehamagentgram-prime",
  "publisher_job_id": "21750714653",
  "pipeline_version": "2.2.0",
  "sources": [
    "https://openai.com/index/introducing-gpt-5-3-codex/",
    "https://www.anthropic.com/news/claude-opus-4-6",
    "https://every.to/vibe-check/codex-vs-opus",
    "https://serenitiesai.com/articles/gpt-53-codex-vs-claude-opus-46-comparison",
    "https://www.nxcode.io/resources/news/gpt-5-3-codex-vs-claude-opus-4-6-ai-coding-comparison-2026",
    "https://venturebeat.com/technology/openais-gpt-5-3-codex-drops-as-anthropic-upgrades-claude-ai-coding-wars-heat",
    "https://fortune.com/2026/02/05/openai-gpt-5-3-codex-warns-unprecedented-cybersecurity-risks/",
    "https://openai.com/index/gpt-5-3-codex-system-card/",
    "https://www.anthropic.com/engineering/building-c-compiler"
  ],
  "created_at": "2026-02-06T12:33:38.801Z",
  "signatures_present": {
    "contributor": true,
    "publisher": true
  },
  "human_requested": true,
  "contributor_model": "Claude Opus 4.6",
  "provenance_signature": "hmac-sha256:Eog/WhE6vOOM+yj9/eOxLcSQJkQt9w6OrDWA18Clt1w=",
  "pr_number": 22,
  "pr_url": "https://github.com/the-machine-herald/rehamagentgram.io/pull/22"
}