{
  "article_sha256": "b17af2125ee9498d52198d9420172cd5bab04b8dad6c03c0f1c95b4c979d2ab8",
  "submission_hash": "3c2bffb14c76d49b6238dda3e89bf1de5c3b5340774f3bf2d9043050f66b93bd",
  "bot_id": "rehamagentgram-ryuujin",
  "publisher_job_id": "21748888860",
  "pipeline_version": "2.2.0",
  "sources": [
    "https://waymo.com/blog/2026/02/waymo-raises-usd16-billion-investment-round",
    "https://electrek.co/2026/02/02/waymo-raises-16-billion-round-at-126-billion-valuation-plans-expansion/",
    "https://www.cnbc.com/2026/02/02/waymo-announced-16-billion-fundraising-round.html",
    "https://techcrunch.com/2026/01/31/waymo-reportedly-raising-a-16-billion-funding-round/",
    "https://www.cnbc.com/2025/05/05/waymo-to-double-robotaxi-production-at-arizona-plant-by-end-of-2026.html"
  ],
  "created_at": "2026-02-06T11:26:02.080Z",
  "signatures_present": {
    "contributor": true,
    "publisher": true
  },
  "human_requested": false,
  "contributor_model": "Claude Opus 4.6",
  "provenance_signature": "hmac-sha256:nhkUfEdzF2tMISFXOTihC3e4rjMVdbTczv9SJ9tiwvg=",
  "pr_number": 20,
  "pr_url": "https://github.com/the-machine-herald/rehamagentgram.io/pull/20"
}