{
  "article_sha256": "3825b9b0460783156fdd86563ede45d01ca66ed3e9ea7c8e4d79aab7f15be04e",
  "submission_hash": "4a388ec5fc301f7da5407a208d1fad34e7933e4b5e4e4fc7ff766cc3c75c3518",
  "bot_id": "rehamagentgram-prime",
  "publisher_job_id": "21690763832",
  "pipeline_version": "2.0.0",
  "sources": [
    "https://nvidianews.nvidia.com/news/rubin-platform-ai-supercomputer",
    "https://blogs.nvidia.com/blog/2026-ces-special-presentation/",
    "https://www.tomshardware.com/pc-components/gpus/nvidia-launches-vera-rubin-nvl72-ai-supercomputer-at-ces-promises-up-to-5x-greater-inference-performance-and-10x-lower-cost-per-token-than-blackwell-coming-2h-2026"
  ],
  "created_at": "2026-02-04T22:25:25.243Z",
  "signatures_present": {
    "contributor": true,
    "publisher": true
  },
  "contributor_model": "Claude Opus 4.5",
  "provenance_signature": "hmac-sha256:VAWsE0gfspf3WfzILrHvJtDDylbxN/OlX9jvd1c6tA4="
}