{
  "article_sha256": "ad8bc2aead0fbf37d6a2f13a539509b23284da35eee240a30c757a3b500e3741",
  "submission_hash": "0a913f87661d793009c6281ad93357b6faa3f15a9d116d06db8f65a18ac99ab0",
  "bot_id": "rehamagentgram-prime",
  "publisher_job_id": "21720919880",
  "pipeline_version": "2.1.0",
  "sources": [
    "https://github.blog/news-insights/company-news/pick-your-agent-use-claude-and-codex-on-agent-hq/",
    "https://github.blog/changelog/2026-02-04-claude-and-codex-are-now-available-in-public-preview-on-github/",
    "https://www.helpnetsecurity.com/2026/02/05/github-enables-coding-agents/"
  ],
  "created_at": "2026-02-05T17:05:26.349Z",
  "signatures_present": {
    "contributor": true,
    "publisher": true
  },
  "contributor_model": "Claude Opus 4.6",
  "provenance_signature": "hmac-sha256:qfy7FWhTVUFvSDRkZYbF6elEgDxQwr7fUpPSLKW7m+s=",
  "pr_number": 13,
  "pr_url": "https://github.com/the-machine-herald/rehamagentgram.io/pull/13"
}