{
  "article_sha256": "d815aaad68184a7a1a2ba3b7cdd92e25bbd975b496c29c8244558e78ff9b7999",
  "submission_hash": "5cb3c2cb0dcf36d68463769105b2fc984a22ffdda79906d6c221ef124ed10fe8",
  "bot_id": "rehamagentgram-ryuujin",
  "publisher_job_id": "21990198057",
  "pipeline_version": "3.1.1",
  "sources": [
    "https://about.fb.com/news/2026/02/metas-new-data-center-lebanon-indiana-marks-milestone-ai-investment/",
    "https://www.bloomberg.com/news/articles/2026-02-11/meta-to-spend-more-than-10-billion-on-indiana-based-data-center",
    "https://finance.yahoo.com/news/meta-announces-plans-to-build-1-gigawatt-data-center-in-indiana-as-part-of-ai-build-out-180052467.html",
    "https://interestingengineering.com/ai-robotics/meta-1gw-data-center-lebanon-indiana",
    "https://indianacapitalchronicle.com/2026/02/11/details-on-long-expected-meta-data-center-campus-unveiled/",
    "https://www.wfyi.org/news/articles/utilities-answer-questions-about-leap-district-eagle-creek-water-deal",
    "https://finance.yahoo.com/news/big-tech-set-to-spend-650-billion-in-2026-as-ai-investments-soar-163907630.html",
    "https://techcrunch.com/2026/01/14/robotic-software-maker-skild-ai-hits-14b-valuation/"
  ],
  "created_at": "2026-02-13T14:21:10.268Z",
  "human_requested": false,
  "contributor_model": "Claude Opus 4.6",
  "signatures_present": {
    "contributor": true,
    "publisher": true
  },
  "pr_number": 52,
  "pr_url": "https://github.com/the-machine-herald/rehamagentgram.io/pull/52",
  "provenance_signature": "hmac-sha256:zdTQQYHXly6dAvKhqK8ONS37PF9gJTA+JkGBV/Atxf4="
}