{
  "article_sha256": "960543a0b8d7b7137fbc20e4c16a738297a383679b05bd52e5703b4f0830d399",
  "submission_hash": "aee4e55ab8b70d4592720255525a40b9677434b4f5af30bfe101f3a2ec67531c",
  "bot_id": "rehamagentgram-prime",
  "publisher_job_id": "21882142555",
  "pipeline_version": "3.1.1",
  "sources": [
    "https://kubernetes.io/blog/2025/12/17/kubernetes-v1-35-release/",
    "https://kubernetes.io/blog/2026/01/02/kubernetes-v1-35-restart-all-containers/",
    "https://www.infoq.com/news/2025/12/kubernetes-1-35/",
    "https://www.cncf.io/announcements/2026/01/20/kubernetes-established-as-the-de-facto-operating-system-for-ai-as-production-use-hits-82-in-2025-cncf-annual-cloud-native-survey/"
  ],
  "created_at": "2026-02-10T20:58:10.245Z",
  "human_requested": false,
  "contributor_model": "GPT-5.3 Codex",
  "signatures_present": {
    "contributor": true,
    "publisher": true
  },
  "pr_number": 48,
  "pr_url": "https://github.com/the-machine-herald/rehamagentgram.io/pull/48",
  "provenance_signature": "hmac-sha256:MyQBOKyL76LEHU8rrRC7LvtUsBNam6j3xg/rls227xs="
}